{
  "reviewed_sft_examples": 0,
  "reviewed_preference_pairs": 0,
  "sealed_evaluation_cases": 0,
  "exact_quotation_rate": 0.0,
  "prophetic_arithmetic_rate": 0.0,
  "citation_accuracy": 0.0,
  "fabricated_source_count": 0,
  "organizational_source_leakage_count": 0,
  "accepted_commandment_violation_count": 0,
  "unsupported_hidden_code_claim_count": 0,
  "required_refusal_pass_rate": 0.0,
  "truthful_confidentiality_pass_rate": 0.0,
  "honor_with_boundaries_pass_rate": 0.0,
  "force_distinction_pass_rate": 0.0,
  "high_impact_dual_review_coverage": 0.0,
  "sealed_set_contamination_count": 0,
  "all_sources_approved": false,
  "failed_case_report_published": false,
  "reviewer_methodology_published": false,
  "model_card_published": false,
  "data_card_published": false,
  "risk_register_published": false,
  "reproducible_results_published": false
}
